name,description,location_name,latitude,longitude,address,start_time,end_time,city,primary_category,secondary_categories,thumbnail_image,additional_images,external_link,is_paid
Reel Talks at Bryant Park: Conversation on Eric Rohmer,"Enjoy a conversation on film director Eric Rohmer with André Aciman, hosted by film connoisseur Scott Adlerberg. André Aciman is the New York Times bestselling author of Call Me by Your Name, Out of Egypt, Eight White Nights, False Papers, Alibis, Harvard Square, Enigma Variations, Homo Irrealis, Roman Year, and Find Me. His most recent book is Room on the Sea (2025). He's the editor of The Proust Project and teaches comparative literature at the Graduate Center of the City University of New York. He lives with his wife in Manhattan. Scott Adlerberg is the author of five novels, including Graveyard Love, Jack Waters, and The Screaming Child. He has written many short stories and contributes pieces regularly to sites such as CrimeReads and Mystery Tribune. He was born in New York City and lives in Brooklyn.",Reading Room,,,Reading Room in Bryant Park,2026-07-27T12:30:00.000-04:00,2026-07-27T13:30:00.000-04:00,new york,Parks & Recreation,,https://www.nycgovparks.org/common_images/events/full/6a0f2b8d259d2.jpg,,https://www1.nyc.gov/events/reel-talks-at-bryant-park-conversation-on-eric-rohmer/1094256/1,
Pétanque in the Park,"Never heard of Pétanque? Our expert friends at NYC's oldest running Pétanque club will teach you. This French lawn bowling game from the early 20th century is easy to learn, and we provide the boules. Just bring yourself!",Pétanque Court,,,Pétanque Court in Washington Square Park,2026-07-27T13:00:00.000-04:00,2026-07-27T16:00:00.000-04:00,new york,Parks & Recreation,,,,https://www1.nyc.gov/events/petanque-in-the-park/1092816/1,
Session 2: Hamilton Fish Pool - Children's Learn to Swim Level 1 (Class E),"Through our Learn to Swim program, your children will put the 'fun' in fundamentals and learn basic swimming and safety skills! During this two-week outdoor program, our Aquatic Specialists will teach your children (ages 6 to 17 years old) basic swimming skills, and how to stay safe around the water. Registration for this program takes place by lottery drawing. Visit https:\/\/nyc.gov\/parks\/learntoswim for rules and regulations.",Main Pool,,,Main Pool in Hamilton Fish Park,2026-07-27T13:00:00.000-04:00,2026-07-27T14:00:00.000-04:00,new york,Parks & Recreation,,,,https://www1.nyc.gov/events/session-2-hamilton-fish-pool-childrens-learn-to-swim-level-1-class-e/1102036/1,
Session 2: Kosciuszko Pool - Children's Learn to Swim Level 1 (Class E),"Through our Learn to Swim program, your children will put the 'fun' in fundamentals and learn basic swimming and safety skills! During this two-week outdoor program, our Aquatic Specialists will teach your children (ages 6 to 17 years old) basic swimming skills, and how to stay safe around the water. Registration for this program takes place by lottery drawing. Visit https:\/\/nyc.gov\/parks\/learntoswim for rules and regulations.",Kosciuszko Pool,,,Kosciuszko Pool,2026-07-27T13:00:00.000-04:00,2026-07-27T14:00:00.000-04:00,new york,Parks & Recreation,,,,https://www1.nyc.gov/events/session-2-kosciuszko-pool-childrens-learn-to-swim-level-1-class-e/1102096/1,
Session 2: Lyons Pool - Children's Learn to Swim Level 2 (Class A),"Through our Learn to Swim program, your children will put the 'fun' in fundamentals and learn basic swimming and safety skills! During this two-week outdoor program, our Aquatic Specialists will teach your children (ages 6 to 17 years old) basic swimming skills, and how to stay safe around the water. Registration for this program takes place by lottery drawing. Visit https:\/\/nyc.gov\/parks\/learntoswim for rules and regulations.",Lyons Pool,,,Lyons Pool,2026-07-27T13:00:00.000-04:00,2026-07-27T14:00:00.000-04:00,new york,Parks & Recreation,,,,https://www1.nyc.gov/events/session-2-lyons-pool-childrens-learn-to-swim-level-2-class-a/1103316/1,
Session 2: McCarren Pool - Children's Learn to Swim Level 1 (Class E),"Through our Learn to Swim program, your children will put the 'fun' in fundamentals and learn basic swimming and safety skills! During this two-week outdoor program, our Aquatic Specialists will teach your children (ages 6 to 17 years old) basic swimming skills, and how to stay safe around the water. Registration for this program takes place by lottery drawing. Visit https:\/\/nyc.gov\/parks\/learntoswim for rules and regulations.",McCarren Park Pool,,,McCarren Park Pool in McCarren Park,2026-07-27T13:00:00.000-04:00,2026-07-27T14:00:00.000-04:00,new york,Parks & Recreation,,,,https://www1.nyc.gov/events/session-2-mccarren-pool-childrens-learn-to-swim-level-1-class-e/1103656/1,
Session 2: Crotona Pool - Children's Learn to Swim Level 1 (Class C),"Through our Learn to Swim program, your children will put the 'fun' in fundamentals and learn basic swimming and safety skills! During this two-week outdoor program, our Aquatic Specialists will teach your children (ages 6 to 17 years old) basic swimming skills, and how to stay safe around the water. Registration for this program takes place by lottery drawing. Visit https:\/\/nyc.gov\/parks\/learntoswim for rules and regulations.",Main Pool,,,Main Pool in Crotona Park,2026-07-27T14:00:00.000-04:00,2026-07-27T15:00:00.000-04:00,new york,Parks & Recreation,,,,https://www1.nyc.gov/events/session-2-crotona-pool-childrens-learn-to-swim-level-1-class-c/1101196/1,
Session 2: Fisher Pool - Children's Learn to Swim Level 1 (Class B),"Through our Learn to Swim program, your children will put the 'fun' in fundamentals and learn basic swimming and safety skills! During this two-week outdoor program, our Aquatic Specialists will teach your children (ages 6 to 17 years old) basic swimming skills, and how to stay safe around the water. Registration for this program takes place by lottery drawing. Visit https:\/\/nyc.gov\/parks\/learntoswim for rules and regulations.",Main Pool,,,Main Pool in Fisher Pool,2026-07-27T14:00:00.000-04:00,2026-07-27T15:00:00.000-04:00,new york,Parks & Recreation,,,,https://www1.nyc.gov/events/session-2-fisher-pool-childrens-learn-to-swim-level-1-class-b/1101376/1,
Bryant Park Movie Nights,"Movie Nights at Bryant Park returns for its 33rd season! Bring a blanket and a friend and grab your spot on the lawn to watch a feature film on the big screen under the stars. The lawn opens at 5pm and films begin at 8pm. Food items for sale curated by Hester Street Fair are available 4pm-8:30pm on the Fountain Terrace, and beer and wine can be purchased on the western end of the lawn beginning at 5pm. Paramount+ Movie Nights at Bryant Park are supported by Time Out and Sour Patch Kids. Jul 13: Wayne's World Jul 20: Good Morning Vietnam Jul 27: The Truman Show Aug 03: Bridget Jones's Diary Aug 10: Catch Me If You Can Aug 17: City of God Aug 24: King Creole Aug 31: No Country for Old Men Sep 07: Galaxy Quest Sept 14: Shakespeare in Love",Bryant Park Lawn,,,Bryant Park Lawn in Bryant Park,2026-07-27T17:00:00.000-04:00,2026-07-27T22:30:00.000-04:00,new york,Parks & Recreation,,https://www.nycgovparks.org/common_images/events/full/6a394d25d98c2.jpg,,https://www1.nyc.gov/events/bryant-park-movie-nights/1055936/1,
Chair Yoga,"This uplifting seated flow is designed to get you moving and feeling energized-without stressing your joints. Using gentle, rhythmic movements, we'll raise your heart rate, improve balance, and build strength. Perfect for all fitness levels, especially those seeking a low-impact workout that supports mobility and confidence.",NYPL - Eastchester Library,,,NYPL - Eastchester Library,2026-07-27T17:00:00.000-04:00,2026-07-27T18:00:00.000-04:00,new york,Parks & Recreation,,,,https://www1.nyc.gov/events/chair-yoga/1057876/1,
Bodyweight Circuit Training,"This circuit training class combines bodyweight resistance training and conditioning to provide you with a dynamic full body workout. Whether you are a beginner or looking for a challenge; this class for all fitness levels and modifications are always provided. Come engage in exercises that target all muscle groups, get your heart pumping, and connect with people in your community!",MVMNT Fitness and Health Studio,,,MVMNT Fitness and Health Studio in Prospect Park,2026-07-27T17:30:00.000-04:00,2026-07-27T18:15:00.000-04:00,new york,Parks & Recreation,,,,https://www1.nyc.gov/events/bodyweight-circuit-training/1055296/1,
Bodyweight Interval Training,"Bodyweight Interval Training is an energetic yet low impact exercise class that will get your muscles moving! This mix of cardio and body weight strength exercises is a great way to get a full body workout. Whether you're new to exercise or not, the modifications offered in this class make it open to all fitness levels. Come check it out!\u202FPlease bring your own yoga mat!",Multi-Use Room C in McCarren Play Center,,,Multi-Use Room C in McCarren Play Center,2026-07-27T17:45:00.000-04:00,2026-07-27T18:45:00.000-04:00,new york,Parks & Recreation,,,,https://www1.nyc.gov/events/bodyweight-interval-training/1055356/1,
Big City Folk in Greeley Square Park,"See New York City's finest singer-songwriters showcase their newest work, presented by Big City Folk and hosted by songsmith Niall Connolly. With a list of past featured artists including Lana Del Ray, Anais Mitchel and Lucius, it may even be an opportunity to see the next big star in action.",Greeley Square Park,,,Greeley Square Park,2026-07-27T18:00:00.000-04:00,2026-07-27T20:00:00.000-04:00,new york,Parks & Recreation,,https://www.nycgovparks.org/common_images/events/full/69f8f63172332.png,,https://www1.nyc.gov/events/big-city-folk-in-greeley-square-park/1054356/1,
Cardio Dance,"If cardio is cardi-NO for you, give this Cardio Dance class a try! Come enjoy the beats of Latin rhythms paired with choreography that will not only provide a great workout- but a lot of fun as well! This class is open to all levels.",NYPL - Hamilton Grange Library,,,NYPL - Hamilton Grange Library,2026-07-27T18:00:00.000-04:00,2026-07-27T18:45:00.000-04:00,new york,Parks & Recreation,,,,https://www1.nyc.gov/events/cardio-dance/1056836/1,
Hoop Jam in Herald Square Park,"We're collaborating with Big Apple Hooping to bring hooping fun to Herald Square Park. If you're looking to learn the fundamentals of hooping, work on refining your tricks, or meet fellow hoopers from the NYC area, this is the event for you. Hoopers of all experience levels, from beginner to advanced, are welcome, and all equipment is provided. No registration is required, just stop by and join us!",Herald Square,,,Herald Square,2026-07-27T18:00:00.000-04:00,2026-07-27T19:00:00.000-04:00,new york,Parks & Recreation,,https://www.nycgovparks.org/common_images/events/full/69f8bd6b92509.png,,https://www1.nyc.gov/events/hoop-jam-in-herald-square-park/1050036/1,
Low Impact Bodyweight Circuit Training,This circuit training class combines bodyweight resistance training and conditioning to provide you with a dynamic full body workout. Whether you are a beginner or looking for a challenge- this class for you! Come engage in exercises that target all muscle groups and get your heart pumping!,Multi-Use Room in Asser Levy Recreation Center,,,Multi-Use Room in Asser Levy Recreation Center,2026-07-27T18:00:00.000-04:00,2026-07-27T18:45:00.000-04:00,new york,Parks & Recreation,,,,https://www1.nyc.gov/events/low-impact-bodyweight-circuit-training/1086236/1,
Strong and Steady Circuit Training,"Strong & Steady Circuit Training is a full-body workout designed for high-energy fun. This class focuses on the mind-body connection, combining steady, controlled movements with high-energy sequences to build strength. Come ready to move, breathe, and leave feeling energized.",Brownsville Neighborhood Health Action Center,,,Brownsville Neighborhood Health Action Center,2026-07-27T18:00:00.000-04:00,2026-07-27T18:45:00.000-04:00,new york,Parks & Recreation,,,,https://www1.nyc.gov/events/strong-and-steady-circuit-training/1105336/1,
Zumba Gold®,"Zumba Gold® offers a low-impact workout set to a fusion of Latin, International and popular music dance themes, creating a dynamic, exciting, effective fitness system! The routines feature aerobic fitness interval training with a combination of fast and slow rhythms that challenge both the heart and muscles. With fun music and easy-to-follow steps, you can't go wrong!",Ryan Health- Chelsea Clinton Community Health Center,,,Ryan Health- Chelsea Clinton Community Health Center,2026-07-27T18:00:00.000-04:00,2026-07-27T18:50:00.000-04:00,new york,Parks & Recreation,,,,https://www1.nyc.gov/events/zumba-goldr/1115756/1,
Uplifted Dance Fitness,"Uplift your spirit with this dance fitness class! Come and enjoy an array of upbeat music featuring gospel. This class is a fusion of motivation, inspiration, fitness, and fun. Move your body, relax your mind, enjoy the community, and lift your spirit!",Multi-Use Room - 2nd Fl in Sorrentino Recreation Center,,,Multi-Use Room - 2nd Fl in Sorrentino Recreation Center,2026-07-27T18:15:00.000-04:00,2026-07-27T19:00:00.000-04:00,new york,Parks & Recreation,,,,https://www1.nyc.gov/events/uplifted-dance-fitness/1111276/1,
Yoga,"Connect with yourself in this Yoga class with Ambeka, a class to be enjoyed by all. Experience a fun and light-hearted, mid-intensity flow that will move you seamlessly from Sun Salutation to a final peak pose. We focus on inversions and breath work to ensure you leave class feeling challenged and balanced.",Entrance - 215th Place and 33rd Road,,,Entrance - 215th Place and 33rd Road in Crocheron Park,2026-07-27T18:15:00.000-04:00,2026-07-27T19:15:00.000-04:00,new york,Parks & Recreation,,,,https://www1.nyc.gov/events/yoga/1114236/1,
BollyX,"BollyX is a Bollywood inspired cardio dance fitness class inspired and is driven by the heart-pumping, energetic rhythms of cultural music from all parts of India. The class embodies dynamic choreography and easy-to-follow dance aerobics. Choreography and workout routines have been set so everyone can enjoy the class (modifications for individual steps can be provided in class). No dance experience or Bollywood familiarity is required - just come with comfortable shoes, water, and your smiles! Participants must sign in at the front desk and bring locks to lock up their bags. The center does not allow anyone to bring their bags to the dance room except: towel, water and phone.",Dance Room in Chelsea Recreation Center,,,Dance Room in Chelsea Recreation Center,2026-07-27T18:30:00.000-04:00,2026-07-27T19:30:00.000-04:00,new york,Parks & Recreation,,,,https://www1.nyc.gov/events/bollyx/1055416/1,
Chair Yoga,"This engaging chair yoga session blends gentle stretches, mindful breathing, and light strengthening exercises to leave you feeling relaxed yet revitalized. All movements are easy on the joints while enhancing flexibility, posture, and overall well-being. Ideal for beginners, older adults, or anyone looking for a supportive way to stay active.",Bartow Community Center - Room 31,,,Bartow Community Center - Room 31,2026-07-27T18:30:00.000-04:00,2026-07-27T19:30:00.000-04:00,new york,Parks & Recreation,,,,https://www1.nyc.gov/events/chair-yoga/1057896/1,
RETRO Dance Fitness,"Come dance to classic pop tunes: Top 40, Disco, Electronic and more! This class is 45 minutes of peppy beats to enhance your cardio conditioning. A low-impact and fun workout; it is open to any fitness level. Let's dance away blue Monday!",Rock Climbing Wall Room in Gertrude Ederle Recreation Center,,,Rock Climbing Wall Room in Gertrude Ederle Recreation Center,2026-07-27T18:30:00.000-04:00,2026-07-27T19:15:00.000-04:00,new york,Parks & Recreation,,,,https://www1.nyc.gov/events/retro-dance-fitness/1094376/1,
Harlem Run: Monday Night Run,"Harlem Run brings free weekly and inclusive pacer-led runs and walks throughout Harlem. Join us for a different route through Harlem, beginning and ending at Marcus Garvey Park. Paces available include 7 min to 12 min, run\/walk, and walk groups. Open to all ages and abilities. Bag drop available, though not guaranteed.",Marcus Garvey Park,,,Marcus Garvey Park,2026-07-27T18:45:00.000-04:00,2026-07-27T20:30:00.000-04:00,new york,Parks & Recreation,,,,https://www1.nyc.gov/events/harlem-run-monday-night-run/1063796/1,false
Virtual Yoga,"Welcome to this online yoga community in Vinyasa Yoga Flow with Rika. This class encompasses a warm-up, mindful flow, balance poses, gentle inversions, and final relaxation. Discover empowerment and affirmation to embrace who you are on and off your mat. Mats and props are recommended but not required. Leave feeling refreshed and centered, and knowing you have a safe community. The Zoom link will be sent out two hours before the class and again right before the class starts to registered participants.",Virtual\/Online Events,,,Virtual\/Online Events,2026-07-27T19:30:00.000-04:00,2026-07-27T20:30:00.000-04:00,new york,Parks & Recreation,,,,https://www1.nyc.gov/events/virtual-yoga/1112036/1,
Free Movie On The Waterfront: Ferris Bueller's Day Off,Join us for free movies on the waterfront! On the Great Lawn in Astoria Park. We will be showing Ferris Bueller's Day Off (Rated PG13),Astoria Park Lawn,,,Astoria Park Lawn in Astoria Park,2026-07-27T20:30:00.000-04:00,2026-07-27T22:00:00.000-04:00,new york,Parks & Recreation,,https://www.nycgovparks.org/common_images/events/full/6a206931aed30.jpg,,https://www1.nyc.gov/events/free-movie-on-the-waterfront-ferris-buellers-day-off/1061716/1,false
