name,description,location_name,latitude,longitude,address,start_time,end_time,city,primary_category,secondary_categories,thumbnail_image,additional_images,external_link,is_paid
Zumba,"Zumba is a fusion of Latin, International and popular music dance themes creating a dynamic, exciting, effective fitness system! The routines feature aerobic, fitness interval training with a combination of fast and slow rhythms that tone and sculpt the body with easy to follow dance steps.",Midland Beach Splash Plaza,,,Midland Beach Splash Plaza in Franklin D. Roosevelt Boardwalk and Beach,2026-07-25T09:00:00.000-04:00,2026-07-25T10:00:00.000-04:00,new york,Parks & Recreation,,,,https://www1.nyc.gov/events/zumba/1115236/1,
It's My Park at East River Esplanade,"This It's My Park season, volunteer with Alliance for Kips Bay for a general cleanup at East River Esplanade. We look forward to cleaning up the park with you!",East River Esplanade,,,East River Esplanade,2026-07-25T09:30:00.000-04:00,2026-07-25T11:00:00.000-04:00,new york,Parks & Recreation,,,,https://www1.nyc.gov/events/its-my-park-at-east-river-esplanade/1051316/1,
It's My Park at Marine Park,"This It's My Park season, volunteer with Marine Park Alliance to beautify Marine Park. We look forward to cleaning up the park with you!",Marine Park,,,Marine Park,2026-07-25T09:30:00.000-04:00,2026-07-25T11:30:00.000-04:00,new york,Parks & Recreation,,,,https://www1.nyc.gov/events/its-my-park-at-marine-park/1049736/1,
7\/25 Vernal Pond Restoration at Highland Park,"Join NYC Parks and The Forest Park Trust as we steward a vernal pool! Volunteers will get to take part in invasive species removal and protecting planted native species. Advance registration is required. All tools will be provided, and no prior experience is needed. Just bring your enthusiasm. Please come dressed in sturdy, closed-toe shoes, long pants and bring your own water bottle.",Vermont Place Parking Lot,,,Vermont Place Parking Lot in Highland Park,2026-07-25T10:00:00.000-04:00,2026-07-25T12:00:00.000-04:00,new york,Parks & Recreation,,,,https://www1.nyc.gov/events/725-vernal-pond-restoration-at-highland-park/1052136/1,
Beginner Yoga,"Connect with yourself in Beginner Yoga, a class to be enjoyed by all. Experience a fun and light-hearted, beginner flow that will move you seamlessly from Sun Salutation to a final peak pose. Please bring a mat. The class meets on the lawn north of Sobelsohn Basketball Court.",Sobelsohn Basketball Court,,,Sobelsohn Basketball Court in Forest Park,2026-07-25T10:00:00.000-04:00,2026-07-25T11:00:00.000-04:00,new york,Parks & Recreation,,,,https://www1.nyc.gov/events/beginner-yoga/1054256/1,
CANCELED: Zumba,"Zumba is a fusion of Latin, International and popular music dance themes creating a dynamic, exciting, effective fitness system! The routines feature aerobic, fitness interval training with a combination of fast and slow rhythms that tone and sculpt the body with easy to follow dance steps.",Gymnasium in St. John&rsquo;s Recreation Center,,,Gymnasium in St. John&rsquo;s Recreation Center,2026-07-25T10:00:00.000-04:00,2026-07-25T11:00:00.000-04:00,new york,Parks & Recreation,,,,https://www1.nyc.gov/events/canceled-zumba/1056496/1,
Cardio Circuit Blast,"This high-energy total body workout will keep you moving with challenging yet fun bodyweight circuits. Cardio Circuit Blast is a heart-pumping, high-intensity class that is open to all levels and the perfect way to increase your overall endurance! Participants must bring locks to lock up their bags. The center does not allow anyone to bring their bags to the dance room except: towel, water and phone.",Dance Room in Thomas Jefferson Recreation Center,,,Dance Room in Thomas Jefferson Recreation Center,2026-07-25T10:00:00.000-04:00,2026-07-25T11:00:00.000-04:00,new york,Parks & Recreation,,,,https://www1.nyc.gov/events/cardio-circuit-blast/1056716/1,
City of Water Day at Kaiser Park,"Join us for our annual City of Water Day event at Kaiser Park, where we will demonstrate expressions of resiliency and \""Living With Water.\""",Kaiser Park,,,Kaiser Park,2026-07-25T10:00:00.000-04:00,2026-07-25T14:00:00.000-04:00,new york,Parks & Recreation,,,,https://www1.nyc.gov/events/city-of-water-day-at-kaiser-park/1058196/1,
City of Water Day at Kaiser Park,"Join the Stewardship Team in celebrating City of Water Day at Kaiser Park! This is a large community event where many organizations will be tabling and other activities will be available. We will be leading a coastal cleanup as well as a seining demo. Come dressed in sturdy boots or shoes, long pants, and clothing that can get dirty. Space is limited and registration is required. Volunteers under 18 must be accompanied by a chaperone. To sign up a group of 5 or more volunteers, please reach out to stewardship@parks.nyc.gov.",Kaiser Park Beach,,,Kaiser Park Beach in Kaiser Park,2026-07-25T10:00:00.000-04:00,2026-07-25T13:00:00.000-04:00,new york,Parks & Recreation,,https://www.nycgovparks.org/common_images/events/full/6a32b30b7a802.JPG,,https://www1.nyc.gov/events/city-of-water-day-at-kaiser-park/1058176/1,
City of Water Day at Sunset Cove Park,"This City of Water Day, volunteer with the Stewardship team to protect coastal areas of Sunset Cove Park! Attendees will help us remove debris that has washed ashore, contributing to the ongoing resilience of Sunset Cove's coastline. Please come dressed in sturdy boots or closed-shoes, long pants and clothing that can get dirty. Please DO NOT wear Crocs, sandals or shorts. Space is limited and registration is required. Volunteers under 18 must be accompanied by a chaperone. To sign up a group of 10 or more volunteers, please reach out to stewardship@parks.nyc.gov.",Sunset Cove,,,Sunset Cove,2026-07-25T10:00:00.000-04:00,2026-07-25T12:00:00.000-04:00,new york,Parks & Recreation,,https://www.nycgovparks.org/common_images/events/full/6a32f4e7b09f5.jpg,,https://www1.nyc.gov/events/city-of-water-day-at-sunset-cove-park/1058216/1,
City of Water Day: Island Hopping Canoeing Excursion,Its City of Water Day! Spend an afternoon exploring the islands that surround the Orchard Beach estuary by canoe. Experienced paddlers only. Participants are chosen by lottery. Lottery registration opens on Monday July 13.,Pelham Bay Park,,,Pelham Bay Park - northwest corner of Orchard Beach parking lot,2026-07-25T10:00:00.000-04:00,2026-07-25T11:30:00.000-04:00,new york,Free,"Parks & Recreation,General Events",https://publish-p136379-e1368845.adobeaemcloud.com/content/dam/nycgov/events/feature/spring-summer-canoe.jpg,,https://www1.nyc.gov/events/city-of-water-day-island-hopping-canoeing-excursion/1116516/1,false
City of Water Day: Soundview Park Guided Walk,"Join NAC staff for an exploration of Soundview Park's Trails. We'll discuss plant identification and maritime woodlands. The Natural Areas Conservancy will host a guided walk on the trails at Soundview Park as part of City of Water Day in order to explore the trail and learn about our local ecosystem. Attendees will learn about plant id, maritime woodlands, and aquatic plants If you are attending, please fill out this volunteer waiver . All ages are welcome. Attendees under 18 will need to be accompanied by an adult. What you should bring: A water bottleWeather-appropriate clothingSturdy, closed-toe shoesInsect repellentLong pants and tall socks recommendedIf you have any questions about this event or would like to learn more about the Natural Areas Conservancy, please visit naturalareasnyc.org, @naturalareasnyc on Ins...",Soundview Park,,,Soundview Park,2026-07-25T10:00:00.000-04:00,2026-07-25T13:00:00.000-04:00,new york,Parks & Recreation,,,,https://www1.nyc.gov/events/city-of-water-day-soundview-park-guided-walk/1058336/1,
City of Water Day with Friends of Inwood Hill Park,"Now in its 19th year, City of Water Day is a region-wide day organized by Waterfront Alliance and New York-New Jersey Harbor & Estuary Program (HEP), to champion a climate-resilient New York and New Jersey harbor. Friends of Inwood Hill Park is joining the Waterfront Alliance for another year to bring waterside programming to Inwood Hill Park alongside some of our favorite partner organizations, including the Urban Park Rangers, BioBus, the American Museum of Natural History, Riverkeeper, and more! We will meet in front of the Inwood Hill Nature Center for a full day of activities, including nature walks, trash cleanups, and more, to celebrate the water that connects our neighborhood and Inwood Hill Park to the larger Hudson River community and beyond.",Inwood Hill Nature Center,,,Inwood Hill Nature Center in Inwood Hill Park,2026-07-25T10:00:00.000-04:00,2026-07-25T16:00:00.000-04:00,new york,Parks & Recreation,,https://www.nycgovparks.org/common_images/events/full/6a46b3cb9231a.png,,https://www1.nyc.gov/events/city-of-water-day-with-friends-of-inwood-hill-park/1058356/1,
Community Recycling Event - Soundview,"DSNY holds pop-up e-waste and textile recycling events in every Community Board district in New York City. \n E-waste items collected at these events include: household and office electronics (computers, laptops, keyboards, printers), smaller entertainment electronics (video game consoles, cell phones, MP3 players), and TVs, VCRs, DVDs, DVRs. \n Textile items include: clothing, shoes, hats, bags, gloves, towels, curtains, bedding, and all clean, dry, unsoiled fabrics. \n Unacceptable items: commercial waste, air conditioners, household appliances, batteries, lightbulbs.",Justice Sonia Sotomayor Community Center,,,1000 Rosedale Avenue,2026-07-25T10:00:00.000-04:00,2026-07-25T14:00:00.000-04:00,new york,Health & Public Safety,"Free,Community Recycling,Disposal,Environment,General Events",https://www.nyc.gov/assets/dsny/images/content/events/community-recycling-events-lesec.png,,https://www1.nyc.gov/site/dsny/events/community-recycling-event-soundview/1117116/1,false
Dance Fitness- Upbeat Pop!,"A 45-minute dance fitness class to your favorite upbeat pop songs! Come prepared to shake, roll, grapevine, and clap. We will use this time to cultivate joy and silliness while getting a great workout and reaping the benefits of cardiovascular fitness. All levels are welcome and encouraged. Whether you want to learn some new choreography or need a space to step-touch and sing, this class is for you!",Audubon Center at the Boathouse,,,Audubon Center at the Boathouse in Prospect Park,2026-07-25T10:00:00.000-04:00,2026-07-25T10:45:00.000-04:00,new york,Parks & Recreation,,,,https://www1.nyc.gov/events/dance-fitness-upbeat-pop/1059816/1,
It's My Park at Tompkins Square Park,"This It's My Park season, volunteer with Friends of Tompkins Square Park for a general cleanup at Tompkins Square Park. We look forward to cleaning up the park with you!",Tompkins Square Park,,,Tompkins Square Park,2026-07-25T10:00:00.000-04:00,2026-07-25T12:00:00.000-04:00,new york,Parks & Recreation,,,,https://www1.nyc.gov/events/its-my-park-at-tompkins-square-park/1048356/1,
Kids In Motion: Addabbo Playground,"The Kids in Motion program engages children in active, outdoors play. A NYC Parks staff member leads four to seven hours of free activities in NYC's playgrounds, including organized sports, games, fitness demos, board games, and more! Kids in Motion is a free, drop-in program without registration. Children can head to the playground during the listed hours of operation to participate. Occasionally a Kids in Motion program may be cancelled due to harsh weather or other conditions. Please note: We recommend that guardians accompany children participating in this program. Kids in Motion is not a childcare program and NYC parks is not responsible for the well-being of attendees.",Addabbo Playground,,,Addabbo Playground in Tudor Park,2026-07-25T10:00:00.000-04:00,2026-07-25T18:00:00.000-04:00,new york,Parks & Recreation,,https://www.nycgovparks.org/common_images/events/full/6a4a01b174870.jpg,,https://www1.nyc.gov/events/kids-in-motion-addabbo-playground/1048836/1,false
Kids In Motion: Alley Springfield Playground,"The Kids In Motion Program engages children in active outdoor play. A NYC Parks staff member leads four to seven hours of free activities in NYC's playgrounds, including organized sports, games, fitness demos, board games, water games, and more! Kids In Motion is a free, drop-in program without registration. Children can head to the playground during the listed hours of operation to participate. Occasionally, a Kids In Motion program may be cancelled due to harsh weather or other conditions. Please note: We recommend that guardians accompany children participating in this program. Kids In Motion is not a childcare program and NYC Parks is not responsible for the well-being of attendees.",Alley Springfield Playground,,,Alley Springfield Playground in Alley Pond Park,2026-07-25T10:00:00.000-04:00,2026-07-25T18:00:00.000-04:00,new york,Parks & Recreation,,https://www.nycgovparks.org/common_images/events/full/6a4a023913dcb.jpg,,https://www1.nyc.gov/events/kids-in-motion-alley-springfield-playground/1064156/1,false
Kids in Motion: Al Quinones Playground,"The Kids in Motion Program engages children in active, outdoor play. A NYC Parks staff member leads four to seven hours of free activities in NYC's playgrounds, including organized sports. games, fitness, demos, board games, water games, and more! Kids in Motion is a free, drop-in program without registration. Children can head to the playground during the listed hours of operation to participate. Occasionally a Kids in motion program may be cancelled due to harsh weather or other conditions. Please note: We recommend that guardians accompany children participating in this program. Kids in Motion is not a childcare program and NYC Parks is not responsible for the well-being of attendees.",Play Area,,,Play Area in Al Quiñones Playground,2026-07-25T10:00:00.000-04:00,2026-07-25T18:00:00.000-04:00,new york,Parks & Recreation,,https://www.nycgovparks.org/common_images/events/full/6a4b98f74ef99.jpg,,https://www1.nyc.gov/events/kids-in-motion-al-quinones-playground/1049336/1,false
Kids in Motion: Anne Loftus Playground,"The Kids in Motion program engages children in active, outdoors play. A NYC Parks staff member leads four to seven hours of free activities in NYC's playgrounds, including organized sports, games, fitness demos, board games, and more! Kids in Motion is a free, drop-in program without registration. Children can head to the playground during the listed hours of operation to participate. Occasionally a kids in Motion program may be cancelled due to harsh weather or other conditions. Please note: We recommend that guardians accompany children participating in this program. Kids in Motion is not a childcare program and NYC parks is not responsible for the well-being of attendees.",Anne Loftus Playground,,,Anne Loftus Playground in Fort Tryon Park,2026-07-25T10:00:00.000-04:00,2026-07-25T18:00:00.000-04:00,new york,Parks & Recreation,,https://www.nycgovparks.org/common_images/events/full/6a4b98e78e5c5.jpg,,https://www1.nyc.gov/events/kids-in-motion-anne-loftus-playground/1064596/1,false
Kids In Motion: Arrochar,"\u200BVega, Shayr (Parks)\u200B The Kids in Motion program engages children in active, outdoor play. A NYC Parks staff member leads four to seven hours of free activities in NYC's playgrounds, including organized sports, games, fitness demos, board games, water games, and more! Kias in Motion is a free, drop-in program without registration. Children can head to the playground during the listed hours of operation to participate. Occasionally a Kids in Motion program may be cancelled due to harsh weather or other conditions. Please note: We recommend that guardians accompany children participating in this program. Kids in Motion is not a childcare program and NYC Parks is not responsible for the well-being of attendees.",Play Area,,,Play Area in Arrochar Playground,2026-07-25T10:00:00.000-04:00,2026-07-25T18:00:00.000-04:00,new york,Parks & Recreation,,,,https://www1.nyc.gov/events/kids-in-motion-arrochar/1065036/1,false
Kids In Motion: Austin J. McDonald's Playground,"The Kids in Motion program engages children in active, outdoor play. A NYC Parks staff member leads four to seven hours of free activities in NYC's playgrounds, including organized sports, games, fitness demos, board games, water games, and more! Kias in Motion is a free, drop-in program without registration. Children can head to the playground during the listed hours of operation to participate. Occasionally a Kids in Motion program may be cancelled due to harsh weather or other conditions. Please note: We recommend that guardians accompany children participating in this program. Kids in Motion is not a childcare program and NYC Parks is not responsible for the well-being of attendees.",Austin J. McDonald Playground Fieldhouse,,,Austin J. McDonald Playground Fieldhouse in Austin J. McDonald Playground,2026-07-25T10:00:00.000-04:00,2026-07-25T18:00:00.000-04:00,new york,Parks & Recreation,,,,https://www1.nyc.gov/events/kids-in-motion-austin-j-mcdonalds-playground/1065476/1,false
Kids in Motion: Ben Abrams Playground,"The Kids in Motion Program engages children in active, outdoor play. A NYC Parks staff member leads four to seven hours of free activities in NYC's playgrounds, including organized sports. games, fitness, demos, board games, water games, and more! Kids in Motion is a free, drop-in program without registration. Children can head to the playground during the listed hours of operation to participate. Occasionally a Kids in motion program may be cancelled due to harsh weather or other conditions. Please note: We recommend that guardians accompany children participating in this program. Kids in Motion is not a childcare program and NYC Parks is not responsible for the well-being of attendees.",Ben Abrams Playground,,,Ben Abrams Playground in Bronx Park,2026-07-25T10:00:00.000-04:00,2026-07-25T18:00:00.000-04:00,new york,Parks & Recreation,,https://www.nycgovparks.org/common_images/events/full/6a4b98d1b06b6.jpg,,https://www1.nyc.gov/events/kids-in-motion-ben-abrams-playground/1065976/1,false
Kids In Motion: Bloomingdale Playground,"The Kids in Motion program engages children in active, outdoors play. A NYC Parks staff member leads four to seven hours of free activities in NYC's playgrounds, including organized sports, games, fitness demos, board games, and more! Kids in Motion is a free, drop-in program without registration. Children can head to the playground during the listed hours of operation to participate. Occasionally a kids in Motion program may be cancelled due to harsh weather or other conditions. Please note: We recommend that guardians accompany children participating in this program. Kids in Motion is not a childcare program and NYC parks is not responsible for the well-being of attendees.",Play Area,,,Play Area in Bloomingdale Playground,2026-07-25T10:00:00.000-04:00,2026-07-25T18:00:00.000-04:00,new york,Parks & Recreation,,https://www.nycgovparks.org/common_images/events/full/6a4a0217bbc6a.jpg,,https://www1.nyc.gov/events/kids-in-motion-bloomingdale-playground/1066456/1,false
Kids In Motion: Bowne Park,"The Kids in Motion program engages children in active, outdoors play. A NYC Parks staff member leads four to seven hours of free activities in NYC's playgrounds, including organized sports, games, fitness demos, board games, and more! Kids in Motion is a free, drop-in program without registration. Children can head to the playground during the listed hours of operation to participate. Occasionally a Kids in Motion program may be cancelled due to harsh weather or other conditions. Please note: We recommend that guardians accompany children participating in this program. Kids in Motion is not a childcare program and NYC parks is not responsible for the well-being of attendees.",Bowne Park Playground,,,Bowne Park Playground in Bowne Park,2026-07-25T10:00:00.000-04:00,2026-07-25T18:00:00.000-04:00,new york,Parks & Recreation,,https://www.nycgovparks.org/common_images/events/full/6a4a01bf01312.jpg,,https://www1.nyc.gov/events/kids-in-motion-bowne-park/1066896/1,false
Kids In Motion: Bowne Playground,"The Kids in Motion program engages children in active, outdoors play. A NYC Parks staff member leads four to seven hours of free activities in NYC's playgrounds, including organized sports, games, fitness demos, board games, and more! Kids in Motion is a free, drop-in program without registration. Children can head to the playground during the listed hours of operation to participate. Occasionally a Kids in Motion program may be cancelled due to harsh weather or other conditions. Please note: We recommend that guardians accompany children participating in this program. Kids in Motion is not a childcare program and NYC parks is not responsible for the well-being of attendees.",Play Area,,,Play Area in Bowne Playground,2026-07-25T10:00:00.000-04:00,2026-07-25T18:00:00.000-04:00,new york,Parks & Recreation,,https://www.nycgovparks.org/common_images/events/full/6a4a020fc638e.jpg,,https://www1.nyc.gov/events/kids-in-motion-bowne-playground/1067336/1,false
Kids In Motion: Brookville Park,"The Kids In Motion Program engages children in active outdoor play. A NYC Parks staff member leads four to seven hours of free activities in NYC's playgrounds, including organized sports, games, fitness demos, board games, water games, and more! Kids In Motion is a free, drop-in program without registration. Children can head to the playground during the listed hours of operation to participate. Occasionally, a Kids In Motion program may be cancelled due to harsh weather or other conditions. Please note: We recommend that guardians accompany children participating in this program. Kids In Motion is not a childcare program and NYC Parks is not responsible for the well-being of attendees.",Brookville Playground,,,Brookville Playground in Brookville Park,2026-07-25T10:00:00.000-04:00,2026-07-25T18:00:00.000-04:00,new york,Parks & Recreation,,https://www.nycgovparks.org/common_images/events/full/6a4a02618d491.jpg,,https://www1.nyc.gov/events/kids-in-motion-brookville-park/1067776/1,false
Kids In Motion: Carl Schruz Park,"The Kids in Motion program engages children in active, outdoors play. A NYC Parks staff member leads four to seven hours of free activities in NYC's playgrounds, including organized sports, games, fitness demos, board games, and more! Kids in Motion is a free, drop-in program without registration. Children can head to the playground during the listed hours of operation to participate. Occasionally a kids in Motion program may be cancelled due to harsh weather or other conditions. Please note: We recommend that guardians accompany children participating in this program. Kids in Motion is not a childcare program and NYC parks is not responsible for the well-being of attendees.",Catbird Playground,,,Catbird Playground in Carl Schurz Park,2026-07-25T10:00:00.000-04:00,2026-07-25T18:00:00.000-04:00,new york,Parks & Recreation,,https://www.nycgovparks.org/common_images/events/full/6a4a01c076bdc.jpg,,https://www1.nyc.gov/events/kids-in-motion-carl-schruz-park/1068216/1,false
Kids in Motion: Columbus Park,"The Kids in Motion program engages children in active, outdoors play. A NYC Parks staff member leads four to seven hours of free activities in NYC's playgrounds, including organized sports, games, fitness demos, board games, and more! Kids in Motion is a free, drop-in program without registration. Children can head to the playground during the listed hours of operation to participate. Occasionally a kids in Motion program may be cancelled due to harsh weather or other conditions. Please note: We recommend that guardians accompany children participating in this program. Kids in Motion is not a childcare program and NYC parks is not responsible for the well-being of attendees.",Columbus Park,,,Columbus Park,2026-07-25T10:00:00.000-04:00,2026-07-25T18:00:00.000-04:00,new york,Parks & Recreation,,https://www.nycgovparks.org/common_images/events/full/6a4a023d61335.jpg,,https://www1.nyc.gov/events/kids-in-motion-columbus-park/1068656/1,false
Kids In Motion: De Matti Playground,"The Kids in Motion program engages children in active, outdoor play. A NYC Parks staff member leads four to seven hours of free activities in NYC's playgrounds, including organized sports, games, fitness demos, board games, water games, and more! Kias in Motion is a free, drop-in program without registration. Children can head to the playground during the listed hours of operation to participate. Occasionally a Kids in Motion program may be cancelled due to harsh weather or other conditions. Please note: We recommend that guardians accompany children participating in this program. Kids in Motion is not a childcare program and NYC Parks is not responsible for the well-being of attendees.",De Matti Playground,,,De Matti Playground in De Matti Park,2026-07-25T10:00:00.000-04:00,2026-07-25T18:00:00.000-04:00,new york,Parks & Recreation,,,,https://www1.nyc.gov/events/kids-in-motion-de-matti-playground/1069096/1,false
