name,description,location_name,latitude,longitude,address,start_time,end_time,city,primary_category,secondary_categories,thumbnail_image,additional_images,external_link,is_paid
Kids In Motion: Elmhurst Park,"The Kids in Motion program engages children in active, outdoors play. A NYC Parks staff member leads four to seven hours of free activities in NYC's playgrounds, including organized sports, games, fitness demos, board games, and more! Kids in Motion is a free, drop-in program without registration. Children can head to the playground during the listed hours of operation to participate. Occasionally a Kids in Motion program may be cancelled due to harsh weather or other conditions. Please note: We recommend that guardians accompany children participating in this program. Kids in Motion is not a childcare program and NYC parks is not responsible for the well-being of attendees.",Playground,,,Playground in Elmhurst Park,2026-07-25T10:00:00.000-04:00,2026-07-25T18:00:00.000-04:00,new york,Parks & Recreation,,https://www.nycgovparks.org/common_images/events/full/6a4a01f098cc3.jpg,,https://www1.nyc.gov/events/kids-in-motion-elmhurst-park/1069536/1,false
Kids In Motion: Faber,"The Kids in Motion program engages children in active, outdoor play. A NYC Parks staff member leads four to seven hours of free activities in NYC's playgrounds, including organized sports, games, fitness demos, board games, water games, and more! Kias in Motion is a free, drop-in program without registration. Children can head to the playground during the listed hours of operation to participate. Occasionally a Kids in Motion program may be cancelled due to harsh weather or other conditions. Please note: We recommend that guardians accompany children participating in this program. Kids in Motion is not a childcare program and NYC Parks is not responsible for the well-being of attendees.",Outdoors at Faber Park Recreation Center in Faber Park Recreation Center,,,Outdoors at Faber Park Recreation Center in Faber Park Recreation Center,2026-07-25T10:00:00.000-04:00,2026-07-25T18:00:00.000-04:00,new york,Parks & Recreation,,,,https://www1.nyc.gov/events/kids-in-motion-faber/1069976/1,false
Kids in Motion: Flynn Playground,"The Kids in Motion Program engages children in active, outdoor play. A NYC Parks staff member leads four to seven hours of free activities in NYC's playgrounds, including organized sports. games, fitness, demos, board games, water games, and more! Kids in Motion is a free, drop-in program without registration. Children can head to the playground during the listed hours of operation to participate. Occasionally a Kids in motion program may be cancelled due to harsh weather or other conditions. Please note: We recommend that guardians accompany children participating in this program. Kids in Motion is not a childcare program and NYC Parks is not responsible for the well-being of attendees.",Play Area,,,Play Area in Flynn Playground,2026-07-25T10:00:00.000-04:00,2026-07-25T18:00:00.000-04:00,new york,Parks & Recreation,,https://www.nycgovparks.org/common_images/events/full/6a3e9b11ac35c.jpg,,https://www1.nyc.gov/events/kids-in-motion-flynn-playground/1070476/1,false
Kids In Motion: Grover Cleveland Playground,"The Kids In Motion Program engages children in active outdoor play. A NYC Parks staff member leads four to seven hours of free activities in NYC's playgrounds, including organized sports, games, fitness demos, board games, water games, and more! Kids In Motion is a free, drop-in program without registration. Children can head to the playground during the listed hours of operation to participate. Occasionally, a Kids In Motion program may be cancelled due to harsh weather or other conditions. Please note: We recommend that guardians accompany children participating in this program. Kids In Motion is not a childcare program and NYC Parks is not responsible for the well-being of attendees.",Play Area,,,Play Area in Grover Cleveland Playground,2026-07-25T10:00:00.000-04:00,2026-07-25T18:00:00.000-04:00,new york,Parks & Recreation,,https://www.nycgovparks.org/common_images/events/full/6a4a026310fa2.jpg,,https://www1.nyc.gov/events/kids-in-motion-grover-cleveland-playground/1070956/1,false
Kids In Motion: Hoover-Manton Playgrounds,"The Kids in Motion program engages children in active, outdoors play. A NYC Parks staff member leads four to seven hours of free activities in NYC's playgrounds, including organized sports, games, fitness demos, board games, and more! Kids in Motion is a free, drop-in program without registration. Children can head to the playground during the listed hours of operation to participate. Occasionally a Kids in Motion program may be cancelled due to harsh weather or other conditions. Please note: We recommend that guardians accompany children participating in this program. Kids in Motion is not a childcare program and NYC parks is not responsible for the well-being of attendees.",Open Area,,,Open Area in Hoover - Manton Playgrounds,2026-07-25T10:00:00.000-04:00,2026-07-25T18:00:00.000-04:00,new york,Parks & Recreation,,https://www.nycgovparks.org/common_images/events/full/6a4a02184e808.jpg,,https://www1.nyc.gov/events/kids-in-motion-hoover-manton-playgrounds/1071396/1,false
Kids in Motion: Hunts Point Playground,"The Kids in Motion Program engages children in active, outdoor play. A NYC Parks staff member leads four to seven hours of free activities in NYC's playgrounds, including organized sports. games, fitness, demos, board games, water games, and more! Kids in Motion is a free, drop-in program without registration. Children can head to the playground during the listed hours of operation to participate. Occasionally a Kids in motion program may be cancelled due to harsh weather or other conditions. Please note: We recommend that guardians accompany children participating in this program. Kids in Motion is not a childcare program and NYC Parks is not responsible for the well-being of attendees.",Basketball Court,,,Basketball Court in Hunts Point Playground,2026-07-25T10:00:00.000-04:00,2026-07-25T18:00:00.000-04:00,new york,Parks & Recreation,,https://www.nycgovparks.org/common_images/events/full/6a4b98f2f1884.jpg,,https://www1.nyc.gov/events/kids-in-motion-hunts-point-playground/1071896/1,false
Kids In Motion: Levy,"The Kids in Motion program engages children in active, outdoor play. A NYC Parks staff member leads four to seven hours of free activities in NYC's playgrounds, including organized sports, games, fitness demos, board games, water games, and more! Kias in Motion is a free, drop-in program without registration. Children can head to the playground during the listed hours of operation to participate. Occasionally a Kids in Motion program may be cancelled due to harsh weather or other conditions. Please note: We recommend that guardians accompany children participating in this program. Kids in Motion is not a childcare program and NYC Parks is not responsible for the well-being of attendees.",Play Area,,,Play Area in Levy Playground,2026-07-25T10:00:00.000-04:00,2026-07-25T18:00:00.000-04:00,new york,Parks & Recreation,,,,https://www1.nyc.gov/events/kids-in-motion-levy/1072376/1,false
Kids In Motion: London Planetree Playground,"The Kids In Motion Program engages children in active outdoor play. A NYC Parks staff member leads four to seven hours of free activities in NYC's playgrounds, including organized sports, games, fitness demos, board games, water games, and more! Kids In Motion is a free, drop-in program without registration. Children can head to the playground during the listed hours of operation to participate. Occasionally, a Kids In Motion program may be cancelled due to harsh weather or other conditions. Please note: We recommend that guardians accompany children participating in this program. Kids In Motion is not a childcare program and NYC Parks is not responsible for the well-being of attendees.",Play Area,,,Play Area in London Planetree Playground,2026-07-25T10:00:00.000-04:00,2026-07-25T18:00:00.000-04:00,new york,Parks & Recreation,,https://www.nycgovparks.org/common_images/events/full/6a4a01d71d000.jpg,,https://www1.nyc.gov/events/kids-in-motion-london-planetree-playground/1072816/1,false
Kids in Motion: Loreto Playground,"The Kids in Motion Program engages children in active, outdoor play. A NYC Parks staff member leads four to seven hours of free activities in NYC's playgrounds, including organized sports. games, fitness, demos, board games, water games, and more! Kids in Motion is a free, drop-in program without registration. Children can head to the playground during the listed hours of operation to participate. Occasionally a Kids in motion program may be cancelled due to harsh weather or other conditions. Please note: We recommend that guardians accompany children participating in this program. Kids in Motion is not a childcare program and NYC Parks is not responsible for the well-being of attendees.",Loreto Playground,,,Loreto Playground,2026-07-25T10:00:00.000-04:00,2026-07-25T18:00:00.000-04:00,new york,Parks & Recreation,,https://www.nycgovparks.org/common_images/events/full/6a4b98b7739c1.jpg,,https://www1.nyc.gov/events/kids-in-motion-loreto-playground/1073296/1,false
Kids In Motion: Lower Highland Playground,"The Kids In Motion Program engages children in active outdoor play. A NYC Parks staff member leads four to seven hours of free activities in NYC's playgrounds, including organized sports, games, fitness demos, board games, water games, and more! Kids In Motion is a free, drop-in program without registration. Children can head to the playground during the listed hours of operation to participate. Occasionally, a Kids In Motion program may be cancelled due to harsh weather or other conditions. Please note: We recommend that guardians accompany children participating in this program. Kids In Motion is not a childcare program and NYC Parks is not responsible for the well-being of attendees.",Lower Highland Playground,,,Lower Highland Playground in Highland Park,2026-07-25T10:00:00.000-04:00,2026-07-25T18:00:00.000-04:00,new york,Parks & Recreation,,https://www.nycgovparks.org/common_images/events/full/6a4a021429e2d.jpg,,https://www1.nyc.gov/events/kids-in-motion-lower-highland-playground/1073776/1,false
Kids in Motion: Metcalf Playground,"The Kids in Motion Program engages children in active, outdoor play. A NYC Parks staff member leads four to seven hours of free activities in NYC's playgrounds, including organized sports. games, fitness, demos, board games, water games, and more! Kids in Motion is a free, drop-in program without registration. Children can head to the playground during the listed hours of operation to participate. Occasionally a Kids in motion program may be cancelled due to harsh weather or other conditions. Please note: We recommend that guardians accompany children participating in this program. Kids in Motion is not a childcare program and NYC Parks is not responsible for the well-being of attendees.",Metcalf Playground,,,Metcalf Playground in Soundview Park,2026-07-25T10:00:00.000-04:00,2026-07-25T18:00:00.000-04:00,new york,Parks & Recreation,,https://www.nycgovparks.org/common_images/events/full/6a3e9aed50013.jpg,,https://www1.nyc.gov/events/kids-in-motion-metcalf-playground/1074276/1,false
Kids In Motion: Nautilus Playground,"The Kids In Motion Program engages children in active outdoor play. A NYC Parks staff member leads four to seven hours of free activities in NYC's playgrounds, including organized sports, games, fitness demos, board games, water games, and more! Kids In Motion is a free, drop-in program without registration. Children can head to the playground during the listed hours of operation to participate. Occasionally, a Kids In Motion program may be cancelled due to harsh weather or other conditions. Please note: We recommend that guardians accompany children participating in this program. Kids In Motion is not a childcare program and NYC Parks is not responsible for the well-being of attendees.",Nautilus Playground,,,Nautilus Playground in Roy Wilkins Recreation Center,2026-07-25T10:00:00.000-04:00,2026-07-25T18:00:00.000-04:00,new york,Parks & Recreation,,https://www.nycgovparks.org/common_images/events/full/6a4a01e4b7e6e.jpg,,https://www1.nyc.gov/events/kids-in-motion-nautilus-playground/1074756/1,false
Kids In Motion: Northern Playground,"The Kids in Motion program engages children in active, outdoors play. A NYC Parks staff member leads four to seven hours of free activities in NYC's playgrounds, including organized sports, games, fitness demos, board games, and more! Kids in Motion is a free, drop-in program without registration. Children can head to the playground during the listed hours of operation to participate. Occasionally a Kids in Motion program may be cancelled due to harsh weather or other conditions. Please note: We recommend that guardians accompany children participating in this program. Kids in Motion is not a childcare program and NYC parks is not responsible for the well-being of attendees.",Northern Blvd. and 94th Street,,,Northern Blvd. and 94th Street in Northern Playground,2026-07-25T10:00:00.000-04:00,2026-07-25T18:00:00.000-04:00,new york,Parks & Recreation,,https://www.nycgovparks.org/common_images/events/full/6a4a01c12cd80.jpg,,https://www1.nyc.gov/events/kids-in-motion-northern-playground/1075196/1,false
"Kids In Motion: Phil \""Scooter\"" Rizzuto Park","The Kids in Motion program engages children in active, outdoors play. A NYC Parks staff member leads four to seven hours of free activities in NYC's playgrounds, including organized sports, games, fitness demos, board games, and more! Kids in Motion is a free, drop-in program without registration. Children can head to the playground during the listed hours of operation to participate. Occasionally a Kids in Motion program may be cancelled due to harsh weather or other conditions. Please note: We recommend that guardians accompany children participating in this program. Kids in Motion is not a childcare program and NYC parks is not responsible for the well-being of attendees.",Playground,,,"Playground in Phil \""Scooter\"" Rizzuto Park",2026-07-25T10:00:00.000-04:00,2026-07-25T18:00:00.000-04:00,new york,Parks & Recreation,,https://www.nycgovparks.org/common_images/events/full/6a4a0221871f7.jpg,,https://www1.nyc.gov/events/kids-in-motion-phil-scooter-rizzuto-park/1075636/1,false
Kids In Motion: P.S. 55,"The Kids in Motion program engages children in active, outdoor play. A NYC Parks staff member leads four to seven hours of free activities in NYC's playgrounds, including organized sports, games, fitness demos, board games, water games, and more! Kias in Motion is a free, drop-in program without registration. Children can head to the playground during the listed hours of operation to participate. Occasionally a Kids in Motion program may be cancelled due to harsh weather or other conditions. Please note: We recommend that guardians accompany children participating in this program. Kids in Motion is not a childcare program and NYC Parks is not responsible for the well-being of attendees.",P.S. 55,,,P.S. 55 in Lieutenant John H. Martinson Playground,2026-07-25T10:00:00.000-04:00,2026-07-25T18:00:00.000-04:00,new york,Parks & Recreation,,,,https://www1.nyc.gov/events/kids-in-motion-ps-55/1076076/1,false
Kids In Motion: Rosemary's Playground,"The Kids in Motion program engages children in active, outdoors play. A NYC Parks staff member leads four to seven hours of free activities in NYC's playgrounds, including organized sports, games, fitness demos, board games, and more! Kids in Motion is a free, drop-in program without registration. Children can head to the playground during the listed hours of operation to participate. Occasionally a Kids in Motion program may be cancelled due to harsh weather or other conditions. Please note: We recommend that guardians accompany children participating in this program. Kids in Motion is not a childcare program and NYC parks is not responsible for the well-being of attendees.",Playground,,,Playground in Rosemary's Playground,2026-07-25T10:00:00.000-04:00,2026-07-25T18:00:00.000-04:00,new york,Parks & Recreation,,https://www.nycgovparks.org/common_images/events/full/6a4a016abfe3a.jpg,,https://www1.nyc.gov/events/kids-in-motion-rosemarys-playground/1076516/1,false
Kids in Motion: Samuel Seabury Playground,"The Kids in Motion program engages children in active, outdoors play. A NYC Parks staff member leads four to seven hours of free activities in NYC's playgrounds, including organized sports, games, fitness demos, board games, and more! Kids in Motion is a free, drop-in program without registration. Children can head to the playground during the listed hours of operation to participate. Occasionally a kids in Motion program may be cancelled due to harsh weather or other conditions. Please note: We recommend that guardians accompany children participating in this program. Kids in Motion is not a childcare program and NYC parks is not responsible for the well-being of attendees.",Samuel Seabury Playground,,,Samuel Seabury Playground,2026-07-25T10:00:00.000-04:00,2026-07-25T18:00:00.000-04:00,new york,Parks & Recreation,,https://www.nycgovparks.org/common_images/events/full/6a4b990626742.jpg,,https://www1.nyc.gov/events/kids-in-motion-samuel-seabury-playground/1076956/1,false
Kids In Motion: Schmul,"\u200BVega, Shayr (Parks)\u200B The Kids in Motion program engages children in active, outdoor play. A NYC Parks staff member leads four to seven hours of free activities in NYC's playgrounds, including organized sports, games, fitness demos, board games, water games, and more! Kias in Motion is a free, drop-in program without registration. Children can head to the playground during the listed hours of operation to participate. Occasionally a Kids in Motion program may be cancelled due to harsh weather or other conditions. Please note: We recommend that guardians accompany children participating in this program. Kids in Motion is not a childcare program and NYC Parks is not responsible for the well-being of attendees.",Playground,,,Playground in Schmul Park,2026-07-25T10:00:00.000-04:00,2026-07-25T18:00:00.000-04:00,new york,Parks & Recreation,,,,https://www1.nyc.gov/events/kids-in-motion-schmul/1077396/1,false
Kids in Motion: Seward Park,"The Kids in Motion program engages children in active, outdoors play. A NYC Parks staff member leads four to seven hours of free activities in NYC's playgrounds, including organized sports, games, fitness demos, board games, and more! Kids in Motion is a free, drop-in program without registration. Children can head to the playground during the listed hours of operation to participate. Occasionally a kids in Motion program may be cancelled due to harsh weather or other conditions. Please note: We recommend that guardians accompany children participating in this program. Kids in Motion is not a childcare program and NYC parks is not responsible for the well-being of attendees.",Entrance - East Broadway & Essex St,,,Entrance - East Broadway & Essex St in Seward Park,2026-07-25T10:00:00.000-04:00,2026-07-25T18:00:00.000-04:00,new york,Parks & Recreation,,https://www.nycgovparks.org/common_images/events/full/6a4a017142a97.jpg,,https://www1.nyc.gov/events/kids-in-motion-seward-park/1077836/1,false
Kids in Motion: Sol Lain Playground,"The Kids in Motion program engages children in active, outdoors play. A NYC Parks staff member leads four to seven hours of free activities in NYC's playgrounds, including organized sports, games, fitness demos, board games, and more! Kids in Motion is a free, drop-in program without registration. Children can head to the playground during the listed hours of operation to participate. Occasionally a kids in Motion program may be cancelled due to harsh weather or other conditions. Please note: We recommend that guardians accompany children participating in this program. Kids in Motion is not a childcare program and NYC parks is not responsible for the well-being of attendees.",Sol Lain Playground,,,Sol Lain Playground in Sol Lain Plgd,2026-07-25T10:00:00.000-04:00,2026-07-25T18:00:00.000-04:00,new york,Parks & Recreation,,https://www.nycgovparks.org/common_images/events/full/6a4a022e50875.jpg,,https://www1.nyc.gov/events/kids-in-motion-sol-lain-playground/1078276/1,false
Kids in Motion: Spuyten Duyvil Playground,"The Kids in Motion Program engages children in active, outdoor play. A NYC Parks staff member leads four to seven hours of free activities in NYC's playgrounds, including organized sports. games, fitness, demos, board games, water games, and more! Kids in Motion is a free, drop-in program without registration. Children can head to the playground during the listed hours of operation to participate. Occasionally a Kids in motion program may be cancelled due to harsh weather or other conditions. Please note: We recommend that guardians accompany children participating in this program. Kids in Motion is not a childcare program and NYC Parks is not responsible for the well-being of attendees.",Play Area,,,Play Area in Spuyten Duyvil Playground,2026-07-25T10:00:00.000-04:00,2026-07-25T18:00:00.000-04:00,new york,Parks & Recreation,,https://www.nycgovparks.org/common_images/events/full/6a4b98acc7490.jpg,,https://www1.nyc.gov/events/kids-in-motion-spuyten-duyvil-playground/1078776/1,false
Kids in Motion: St. James Playground,"The Kids in Motion Program engages children in active, outdoor play. A NYC Parks staff member leads four to seven hours of free activities in NYC's playgrounds, including organized sports. games, fitness, demos, board games, water games, and more! Kids in Motion is a free, drop-in program without registration. Children can head to the playground during the listed hours of operation to participate. Occasionally a Kids in motion program may be cancelled due to harsh weather or other conditions. Please note: We recommend that guardians accompany children participating in this program. Kids in Motion is not a childcare program and NYC Parks is not responsible for the well-being of attendees.",St. James Park Playground,,,St. James Park Playground in St. James Park,2026-07-25T10:00:00.000-04:00,2026-07-25T18:00:00.000-04:00,new york,Parks & Recreation,,https://www.nycgovparks.org/common_images/events/full/6a4b98a61fe69.jpg,,https://www1.nyc.gov/events/kids-in-motion-st-james-playground/1079316/1,false
Kids in Motion: St. Mary's Park West,"The Kids in Motion Program engages children in active, outdoor play. A NYC Parks staff member leads four to seven hours of free activities in NYC's playgrounds, including organized sports. games, fitness, demos, board games, water games, and more! Kids in Motion is a free, drop-in program without registration. Children can head to the playground during the listed hours of operation to participate. Occasionally a Kids in motion program may be cancelled due to harsh weather or other conditions. Please note: We recommend that guardians accompany children participating in this program. Kids in Motion is not a childcare program and NYC Parks is not responsible for the well-being of attendees.",Playground West - Play Area,,,Playground West - Play Area in St. Mary's Park,2026-07-25T10:00:00.000-04:00,2026-07-25T18:00:00.000-04:00,new york,Parks & Recreation,,https://www.nycgovparks.org/common_images/events/full/6a4b98ea27790.jpg,,https://www1.nyc.gov/events/kids-in-motion-st-marys-park-west/1079796/1,false
Kids In Motion: The Big Park,"The Kids in Motion program engages children in active, outdoor play. A NYC Parks staff member leads four to seven hours of free activities in NYC's playgrounds, including organized sports, games, fitness demos, board games, water games, and more! Kias in Motion is a free, drop-in program without registration. Children can head to the playground during the listed hours of operation to participate. Occasionally a Kids in Motion program may be cancelled due to harsh weather or other conditions. Please note: We recommend that guardians accompany children participating in this program. Kids in Motion is not a childcare program and NYC Parks is not responsible for the well-being of attendees.",Entrance - Continental Place and Grandview Avenue,,,Entrance - Continental Place and Grandview Avenue in The Big Park,2026-07-25T10:00:00.000-04:00,2026-07-25T18:00:00.000-04:00,new york,Parks & Recreation,,,,https://www1.nyc.gov/events/kids-in-motion-the-big-park/1080336/1,false
Kids In Motion: Torsney Playground,"The Kids In Motion Program engages children in active outdoor play. A NYC Parks staff member leads four to seven hours of free activities in NYC's playgrounds, including organized sports, games, fitness demos, board games, water games, and more! Kids In Motion is a free, drop-in program without registration. Children can head to the playground during the listed hours of operation to participate. Occasionally, a Kids In Motion program may be cancelled due to harsh weather or other conditions. Please note: We recommend that guardians accompany children participating in this program. Kids In Motion is not a childcare program and NYC Parks is not responsible for the well-being of attendees.",Lou Lodati Playground - Play Area,,,Lou Lodati Playground - Play Area in Torsney Playground,2026-07-25T10:00:00.000-04:00,2026-07-25T18:00:00.000-04:00,new york,Parks & Recreation,,https://www.nycgovparks.org/common_images/events/full/6a4a01ca0a69b.jpg,,https://www1.nyc.gov/events/kids-in-motion-torsney-playground/1080836/1,false
